RecipeId;Alcohol;NonAlcohol;Fruit;Flavour;Chilled;Degree;NoOfLiquid;Title;Ingredient;Step
83;vodka;;lemon|pear;;false;high;1;EssaiCCC;2 lemon|3 pear|4 vodka;{{Preparationtext=* Preparation text
84;malibu rum;guava juice;currant|cherry;;true;high;2;Baywatch;50 cl malibu rum|50 cl cherry|1 l guava juice|10 currant;Mix all ingredients together in a large pitcher.Place in the fridge at least 3 hours before serving.Clink clink!
85;;pineapple juice|passion fruit juice|lemon juice;;grenadine;true;none;3;Bora Bora;10 cl pineapple juice|6 cl passion fruit juice|2 cl grenadine syrup|1 cl lemon juice|3 ice cubes;Make this recipe in a shaker. Serve in a glass over ice with a slice of orange.
86;;water;banana|apple|kiwi fruit;vanilla sugar|brown sugar;true;none;1;Cocktail de Fruits;1 banana|1 apple|2  kiwi fruit|30 cl  water|1 tsp vanilla sugar|3 tsp Brown_sugar;Peel and cut the fruit into pieces.Put them in the blender (or any other container cocktail) and mix everything, adding water little by little, until the desired consistency (I like it when it's a bit thick) .Then add the vanilla sugar and brown sugar, to taste.Mix one last time for the sugar fits well to the mixture.Chill for an hour and enjoy!
87;whiskey|coffee liqueur;rice milk;;cane sugar;true;high;3;Cocktail Latte;4 cl coffee liqueur|4 cl Whiskey|30 cl rice milk|2 cl cane sugar|4  ice cubes;In a shaker, pour all ingredients 2 ice cubes. (Spreading other ice cubes in the glass). Shake the shaker until the ice is melted quasimment.Pour into a large glass or flared to obtain a creamy foam.
88;;water|lemonade;kumquat|litchi|clementine orange|orange;;true;none;2;Cocktail Kumquat and Lychee;5  kumquat|5  litchi|1  clementine|0.5 orange|1 l water|1 l Lemonade;Mix all the fruit in a blender and water until blended.Add a liter of lemonade.Refrigerate 1 hour.
89;tequila;guava juice|pineapple juice|apple juice;;vanilla sugar|mint;true;high;4;Mexican Cocktail in My Way;40 cl tequila|1 l guava juice|1 l Pineapple juice|30 cl apple juice|15 g  vanilla sugar|3 leaf mint;Combine guava juice and pineapple.Add tequila and apple juice.Mix.Add the vanilla sugar and shake until the sugar is melted.Chop the mint leaves and incorporate cocktail.Reserve in the fridge for 12-24 hours.Attention alcohol tequila fades quickly.We do feel almost at the end of 48 hours, so do not prepare too soon.Filter the mixture and serve chilled.
90;;orange juice|lemonade;strawberry;strawberry syrup;true;none;2;Fraisalia Cocktail (without alcohol);500 g strawberry|50 cl Orange juice|10 cl strawberry syrup|2 l Lemonade|10 ice cubes;Place in a bowl chopped strawberries, orange juice and strawberry syrup.Refrigerate at least 2 hours.When ready to serve, add the lemonade and ice cubes.
91;;grape juice|orange juice|schweppes;raspberry|lemon|berry;;true;none;3;Sweet Pink Cocktail;150 g raspberry|1  lemon|8  ice cubes|10 cl grape juice|15 cl Orange juice|10 cl  Schweppes|berry;Pour into the bowl of a mixer raspberries and lemon juice. Mix for fine grout.Chill a cocktail shaker with ice 6. Discard the water and then turn 2 ice cubes, raspberry filtered grape juice and orange juice.Add 10 seconds, then pour into 4 tall glasses.Fill with Schweppes.Decorate with berries.
92;vodka|pear liqueur;peach juice;;strawberry syrup;false;high;3;Red Cocktail;2 cl pear liqueur|2 cl  strawberry syrup|10 cl  peach juice|4 cl  vodka;Mix in a glass the following proportions:40% of lychee liqueur20% of strawberry liqueur40% orange juice.And lively aperitif!
93;;orange juice|pineapple juice|soda water;melon|lime;;true;none;3;Cocktail Sweet Melon;1  Green melon|2  lime|1 l Orange juice|1 l Pineapple juice|1 l soda water;Cut the flesh from the melon.Squeeze the limes.Pour the juice into a bowl.Add the diced melon and let rest in the fridge for 2 hours.Add sparkling water just before serving.
94;angostura bitter|cognac|champagne;;;brown sugar;true;high;3;Champagne Cocktail;1  teaspoon brown sugar|3  cl Angostura bitter|1 cl cognac|8 cl champagne;Place ingredients directly into a glass champagne flute type in the following order:Soak the piece of angostura sugar, then put it at the bottom of a champagne flute.Gently pour the cognac (it should cover the piece of sugar).Fill with chilled champagne.
95;blush wine;orange juice;;orange syrup;false;low;2;Cocktail Variant (based rose);5.33  blush wine|0.66  Orange Syrup|4  l Orange juice;mix wellVery cool drink
96;gin|apple liqueur;orange juice;;mint syrup;false;high;3;Double Show;6 cl gin|10 cl orange juice|2 cl mint syrup|2 cl apple liqueur;{{Preparationtext=
97;white martini|get_27;grapefruit juice;;;true;high;3;Hulk (cocktail);7 cl White martini|5 cl Get_27|6 cl grapefruit juice;Mix all the above in a small cup cocktail ingredients.Add an ice cube or two and ... enjoy!
98;beer;pineapple juice;;strawberry syrup;false;low;2;Cocktail Mexicanos;12 cl beer|12 cl Pineapple juice|3 cl strawberry syrup;In a beer glass, add a dash of strawberry syrup.Complete with beer, tipping the glass to avoid excessive foaming, and then pour the pineapple juice.Drink very fresh.
99;stout|champagne;;;;false;low;2;Black Velvet;12 cl stout|12 cl champagne;Pour the stout and champain together in a class, being careful to ensure there is no overspill.
100;champagne|cointreau;;lime;cane sugar;true;low;2;Champagne Soup (cocktail);8 cl cointreau|16 cl cane sugar|2  lime|1 ice cube|75 cl champagne;Pour into a container Cointreau, cane sugar and lemon juice.Soak overnight.Add the Champagne before serving with ice.
101;white rum;coca-cola;lime;;true;high;2;Cuba Libre;6 cl white rum|1/2 lime|15 cl coca-cola;Squeeze the juice of half a lime into a collins glass.Add ice cubes.Add cola.Stir well.
102;vodka;;apple;strawberry syrup|peach syrup;true;high;1;Tutti Cocktail;2 cl strawberry syrup|2 cl peach syrup|4 cl vodka|4 cl apple|5  ice cubes;Mix in a shaker and add ice.For a small effect, to the strawberry syrup after mixing.
103;white rum|amber rum;pineapple juice|coconut milk;;;true;high;4;Pina Colada;4 cl white rum|2 cl amber rum|12 cl pineapple juice|4 cl coconut milk|1 cup crushed ice;Pour rum, cream of coconut and pineapple juice into a blender with one cup of crushed iceBlend until smooth
104;tequila|cointreau;;strawberry|lime;sugar;true;high;2;Strawberry Margarita;broken ice|2 lime|1 strawberry|20 cl tequila|12 cl cointreau|2 tsp sugar;Wash and hull strawberries. Put ice cubes in a food processor and mix with strawberries.Squeeze the limes. Put the tequila, Cointreau and lemon juice in a measuring with 2 tablespoons sugar.Mix and pour into a blender with crushed ice and strawberries.Decorate glasses of sugar (wet glasses in lemon juice and then dip them in sugar).Divide cocktail in glasses and health!
105;blush wine;grapefruit juice;;grenadine;true;low;2;Pink Cocktail Pink Grapefruit;75 cl blush wine|30 cl grapefruit juice|5 cl grenadine;In a large pitcher, pour the grenadine syrup and rose wine and grapefruit juice.Serve chilled.
106;rum;lemon juice;;grenadine;false;high;2;Bacardi Cocktail, Grenadine, Lemon;24 cl rum|6 cl Grenadine syrup|12 cl lemon juice;Put the grenadine syrup, lemon juice and Bacardi in a shaker.Strongly shake.Pour into glasses and serve immediately.
107;martini|triple sec;multivitamin juice;;cane sugar syrup;true;low;3;MTS Cocktail;50 cl martini|25 cl triple sec|25 cl cane sugar syrup|50 cl multivitamin juice;In a large pitcher, combine all ingredients and mix. Let stand one hour in the refrigerator.A taste very fresh.
108;white wine;orange juice;;grenadine;false;low;2;Madras Cocktail;40 cl Orange juice|20 cl white wine|5 cl Grenadine;Mix orange juice with white wine.Pour into glasses. Add a dash of grenadine.
